<?xml version="1.0" encoding="UTF-8"?>
<?xml-model href="SchematronF1.sch" type="application/xml" schematypens="http://purl.oclc.org/dsdl/schematron"?>
<F1 xmlns:xsi="http://www.w3.org/2001/XMLSchema-instance"
 xsi:schemaLocation="http://FormulaTeamsStua05.com/F1 SchemaF1.xsd"
 xmlns="http://FormulaTeamsStua05.com/F1">
    


        <Team>
            <TeamName ConstructorChampionsWon="6">Red Bull Racing</TeamName>
            <Logo>Loga/RedBullRacing.png</Logo>
            <Drivers>
                <Driver ChampionshipsWon="3">
                    <FirstName>Max</FirstName>
                    <MiddleName>Emilian</MiddleName>
                    <LastName>Verstappen</LastName>
                    <Nationality>Dutch</Nationality>
                    <DriverNumber>1</DriverNumber>
                    <RaceWins>54</RaceWins>
                    <RaceEntries>185</RaceEntries>
                    <Points>2586.5</Points>
                    <Podiums>98</Podiums>
                    <PolePositions>32</PolePositions>
                    <FastestLaps>30</FastestLaps>
                    <DateOfBirth>1998</DateOfBirth>
                </Driver>
                <Driver>
                    <FirstName>Sergio</FirstName>
                    <MiddleName>Michel Mendoza</MiddleName>
                    <LastName>Perez</LastName>
                    <Nationality>Mexican</Nationality>
                    <DriverNumber>11</DriverNumber>
                    <RaceWins>6</RaceWins>
                    <RaceEntries>261</RaceEntries>
                    <Points>1486</Points>
                    <Podiums>32</Podiums>
                    <PolePositions>3</PolePositions>
                    <FastestLaps>11</FastestLaps>
                    <DateOfBirth>1991</DateOfBirth>
                </Driver>
            </Drivers>
            <Cars>
                <CarModel>Red Bull Racing RB19</CarModel>
                <Livery>Red Bull Blue</Livery>
                <EngineSupplier>Honda</EngineSupplier>
            </Cars>
            <TeamBase>
                <Country>United Kingdom</Country>
                <City>Milton Keynes</City>
                <Street>Bradbourne Drive</Street>
            </TeamBase>
            <TeamPrincipal Title="OBE">
                <FirstName>Christian</FirstName>
                <LastName>Horner</LastName>
                <MiddleName>Edward Johnston</MiddleName>
            </TeamPrincipal>
            <TechnicalDirector Title="OBE">
                <FirstName>Adrian</FirstName>
                <LastName>Newey</LastName>
                <MiddleName>Martin</MiddleName>
            </TechnicalDirector>
            <MainSponsor>Oracle</MainSponsor>
            <Founded>2005</Founded>
        </Team>

        <Team>
            <TeamName ConstructorChampionsWon="8">Mercedes-AMG Petronas Formula One Team</TeamName>
            <Logo>Loga/Mercedes-AMGPetronasFormulaOneTeam.png</Logo>
            <Drivers>
                <Driver ChampionshipsWon="7">
                    <FirstName Title="Sir">Lewis</FirstName>
                    <MiddleName>Carl</MiddleName>
                    <LastName>Hamilton</LastName>
                    <Nationality>British</Nationality>
                    <DriverNumber>44</DriverNumber>
                    <RaceWins>103</RaceWins>
                    <RaceEntries>275</RaceEntries>
                    <Points>4361.5</Points>
                    <Podiums>178</Podiums>
                    <PolePositions>103</PolePositions>
                    <FastestLaps>53</FastestLaps>
                    <DateOfBirth>1987</DateOfBirth>
                </Driver>
                <Driver>
                    <FirstName>George</FirstName>
                    <MiddleName>William</MiddleName>
                    <LastName>Russel</LastName>
                    <Nationality>British</Nationality>
                    <DriverNumber>63</DriverNumber>
                    <RaceWins>1</RaceWins>
                    <RaceEntries>59</RaceEntries>
                    <Points>43</Points>
                    <Podiums>11</Podiums>
                    <PolePositions>1</PolePositions>
                    <FastestLaps>6</FastestLaps>
                    <DateOfBirth>2000</DateOfBirth>
                </Driver>
            </Drivers>
            <Cars>
                <CarModel>Mercedes-AMG F1 W14 E Performance</CarModel>
                <Livery>Black</Livery>
                <EngineSupplier>Mercedes</EngineSupplier>
            </Cars>
            <TeamBase>
                <Country>United Kingdom</Country>
                <City>Brackley</City>
                <Street>Lauda Drive</Street>
            </TeamBase>
            <TeamPrincipal>
                <FirstName>Toto</FirstName>
                <LastName>Wolff</LastName>
                <MiddleName>Christian</MiddleName>
            </TeamPrincipal>
            <TechnicalDirector>
                <FirstName>James</FirstName>
                <LastName>Allison</LastName>
                <MiddleName>Andrew</MiddleName>
            </TechnicalDirector>
            <MainSponsor>Petronas</MainSponsor>
            <Founded>2010</Founded>
        </Team>

        <Team>
            <TeamName>Scuderia Ferrari</TeamName>
            <Logo>Loga/ScuderiaFerrari.png</Logo>
            <Drivers>
                <Driver>
                    <FirstName>Charles</FirstName>
                    <MiddleName>Percival</MiddleName>
                    <LastName>Leclerc</LastName>
                    <Nationality>Monegasque</Nationality>
                    <DriverNumber>16</DriverNumber>
                    <RaceWins>5</RaceWins>
                    <RaceEntries>125</RaceEntries>
                    <Points>1074</Points>
                    <Podiums>30</Podiums>
                    <PolePositions>15</PolePositions>
                    <FastestLaps>13</FastestLaps>
                    <DateOfBirth>1998</DateOfBirth>
                </Driver>
                <Driver>
                    <FirstName>Carlos</FirstName>
                    <MiddleName>Vázquez de Castro</MiddleName>
                    <LastName>Sainz</LastName>
                    <Nationality>Spanish</Nationality>
                    <DriverNumber>55</DriverNumber>
                    <RaceWins>2</RaceWins>
                    <RaceEntries>185</RaceEntries>
                    <Points>982.5</Points>
                    <Podiums>18</Podiums>
                    <PolePositions>3</PolePositions>
                    <FastestLaps>2</FastestLaps>
                    <DateOfBirth>1995</DateOfBirth>
                </Driver>
            </Drivers>
            <Cars>
                <CarModel>Ferrari SF-21</CarModel>
                <Livery>Red</Livery>
                <EngineSupplier>Ferrari</EngineSupplier>
            </Cars>
            <TeamBase>
                <Country>Italy</Country>
                <City>Maranello</City>
                <Street>Pastarino</Street>
            </TeamBase>
            <TeamPrincipal>
                <FirstName>Frederic</FirstName>
                <MiddleName>Bino</MiddleName>
                <LastName>Vasser</LastName>
            </TeamPrincipal>
            <TechnicalDirector>
                <FirstName>Enrico</FirstName>
                <MiddleName>Jack</MiddleName>
                <LastName>Galletti</LastName>
            </TechnicalDirector>
            <MainSponsor>Mission Winnow</MainSponsor>
            <Founded>1929</Founded>
        </Team>

        <Team>
            <TeamName ConstructorChampionsWon="2">Alpine F1 Team</TeamName>
            <Logo>Loga/AlpineF1Team.png</Logo>
            <Drivers>
                <Driver>
                    <FirstName>Esteban</FirstName>
                    <LastName>Ocon</LastName>
                    <MiddleName>José Jean-Pierre</MiddleName>
                    <Nationality>French</Nationality>
                    <DriverNumber>31</DriverNumber>
                    <RaceWins>1</RaceWins>
                    <RaceEntries>133</RaceEntries>
                    <Points>422</Points>
                    <Podiums>3</Podiums>
                    <PolePositions>0</PolePositions>
                    <FastestLaps>1</FastestLaps>
                    <DateOfBirth>1999</DateOfBirth>
                </Driver>
                <Driver>
                    <FirstName>Piere</FirstName>
                    <LastName>Gasly</LastName>
                    <MiddleName>Jean-Jacques</MiddleName>
                    <Nationality>French</Nationality>
                    <DriverNumber>10</DriverNumber>
                    <RaceWins>1</RaceWins>
                    <RaceEntries>130</RaceEntries>
                    <Points>218</Points>
                    <Podiums>2</Podiums>
                    <PolePositions>1</PolePositions>
                    <FastestLaps>2</FastestLaps>
                    <DateOfBirth>1998</DateOfBirth>
                </Driver>
            </Drivers>
            <Cars>
                <CarModel>Alpine A523</CarModel>
                <Livery>Blue</Livery>
                <EngineSupplier>Renault</EngineSupplier>
            </Cars>
            <TeamBase>
                <Country>United Kingdom</Country>
                <City>Enstone</City>
                <Street>Chipin Norton</Street>
            </TeamBase>
            <TeamPrincipal>
                <FirstName>Bruno</FirstName>
                <LastName>Famin</LastName>
                <MiddleName>Lucien</MiddleName>
            </TeamPrincipal>
            <TechnicalDirector>
                <FirstName>Eric</FirstName>
                <LastName>Meignan</LastName>
                <MiddleName>Charles</MiddleName>
            </TechnicalDirector>
            <MainSponsor>BWT</MainSponsor>
            <Founded>2021</Founded>
        </Team>

        <Team>
            <TeamName ConstructorChampionsWon="8">McLaren F1 Team</TeamName>
            <Logo>Loga/McLarenF1Team.png</Logo>
            <Drivers>